name,,name_caps
2gether NHS Foundation Trust,,2GETHER NHS FOUNDATION TRUST
5 Boroughs Partnership NHS Foundation Trust,,5 BOROUGHS PARTNERSHIP NHS FOUNDATION TRUST
Avon and Wiltshire Mental Health Partnership NHS Trust,,AVON AND WILTSHIRE MENTAL HEALTH PARTNERSHIP NHS TRUST
"Barnet, Enfield and Haringey Mental Health NHS Trust",,"BARNET, ENFIELD AND HARINGEY MENTAL HEALTH NHS TRUST"
Berkshire Healthcare NHS Foundation Trust,,BERKSHIRE HEALTHCARE NHS FOUNDATION TRUST
Birmingham and Solihull Mental Health NHS Foundation Trust,,BIRMINGHAM AND SOLIHULL MENTAL HEALTH NHS FOUNDATION TRUST
Bradford District Care Trust,,BRADFORD DISTRICT CARE TRUST
Cambridgeshire and Peterborough NHS Foundation Trust,,CAMBRIDGESHIRE AND PETERBOROUGH NHS FOUNDATION TRUST
Camden and Islington NHS Foundation Trust,,CAMDEN AND ISLINGTON NHS FOUNDATION TRUST
Central and North West London NHS Foundation Trust,,CENTRAL AND NORTH WEST LONDON NHS FOUNDATION TRUST
Cheshire and Wirral Partnership NHS Foundation Trust,,CHESHIRE AND WIRRAL PARTNERSHIP NHS FOUNDATION TRUST
Cornwall Partnership NHS Foundation Trust,,CORNWALL PARTNERSHIP NHS FOUNDATION TRUST
Coventry and Warwickshire Partnership NHS Trust,,COVENTRY AND WARWICKSHIRE PARTNERSHIP NHS TRUST
"Cumbria, Northumberland, Tyne and Wear NHS Foundation Trust",,"CUMBRIA, NORTHUMBERLAND, TYNE AND WEAR NHS FOUNDATION TRUST"
Derbyshire Healthcare NHS Foundation Trust,,DERBYSHIRE HEALTHCARE NHS FOUNDATION TRUST
Devon Partnership NHS Trust,,DEVON PARTNERSHIP NHS TRUST
Dorset HealthCare University NHS Foundation Trust,,DORSET HEALTHCARE UNIVERSITY NHS FOUNDATION TRUST
Dudley and Walsall Mental Health Partnership NHS Trust,,DUDLEY AND WALSALL MENTAL HEALTH PARTNERSHIP NHS TRUST
East London NHS Foundation Trust,,EAST LONDON NHS FOUNDATION TRUST
Greater Manchester Mental Health NHS Foundation Trust,,GREATER MANCHESTER MENTAL HEALTH NHS FOUNDATION TRUST
Humber NHS Foundation Trust,,HUMBER NHS FOUNDATION TRUST
Isle of Wight NHS Trust,,ISLE OF WIGHT NHS TRUST
Kent and Medway NHS and Social Care Partnership Trust,,KENT AND MEDWAY NHS AND SOCIAL CARE PARTNERSHIP TRUST
Lancashire Care NHS Foundation Trust,,LANCASHIRE CARE NHS FOUNDATION TRUST
Leeds and York Partnership NHS Foundation Trust,,LEEDS AND YORK PARTNERSHIP NHS FOUNDATION TRUST
Leicestershire Partnership NHS Trust,,LEICESTERSHIRE PARTNERSHIP NHS TRUST
Lincolnshire Partnership NHS Foundation Trust,,LINCOLNSHIRE PARTNERSHIP NHS FOUNDATION TRUST
Mersey Care NHS Trust,,MERSEY CARE NHS TRUST
Norfolk and Suffolk NHS Foundation Trust,,NORFOLK AND SUFFOLK NHS FOUNDATION TRUST
North East London NHS Foundation Trust,,NORTH EAST LONDON NHS FOUNDATION TRUST
North Essex Partnership University NHS Foundation Trust,,NORTH ESSEX PARTNERSHIP UNIVERSITY NHS FOUNDATION TRUST
North Staffordshire Combined Healthcare NHS Trust,,NORTH STAFFORDSHIRE COMBINED HEALTHCARE NHS TRUST
Northamptonshire Healthcare NHS Foundation Trust,,NORTHAMPTONSHIRE HEALTHCARE NHS FOUNDATION TRUST
North Cumbria Integrated Care NHS Foundation Trust,,NORTH CUMBRIA INTEGRATED CARE NHS FOUNDATION TRUST
Nottinghamshire Healthcare NHS Trust,,NOTTINGHAMSHIRE HEALTHCARE NHS TRUST
Oxford Health NHS Foundation Trust,,OXFORD HEALTH NHS FOUNDATION TRUST
Oxleas NHS Foundation Trust,,OXLEAS NHS FOUNDATION TRUST
Pennine Care NHS Foundation Trust,,PENNINE CARE NHS FOUNDATION TRUST
Rotherham Doncaster and South Humber NHS Foundation Trust,,ROTHERHAM DONCASTER AND SOUTH HUMBER NHS FOUNDATION TRUST
Sheffield Health & Social Care NHS Foundation Trust,,SHEFFIELD HEALTH & SOCIAL CARE NHS FOUNDATION TRUST
Somerset Partnership NHS Foundation Trust,,SOMERSET PARTNERSHIP NHS FOUNDATION TRUST
South Essex Partnership University NHS Foundation Trust,,SOUTH ESSEX PARTNERSHIP UNIVERSITY NHS FOUNDATION TRUST
South London and Maudsley NHS Foundation Trust,,SOUTH LONDON AND MAUDSLEY NHS FOUNDATION TRUST
South Staffordshire and Shropshire Healthcare NHS Foundation Trust,,SOUTH STAFFORDSHIRE AND SHROPSHIRE HEALTHCARE NHS FOUNDATION TRUST
South West London and St George's Mental Health NHS Trust,,SOUTH WEST LONDON AND ST GEORGE'S MENTAL HEALTH NHS TRUST
South West Yorkshire Partnership NHS Foundation Trust,,SOUTH WEST YORKSHIRE PARTNERSHIP NHS FOUNDATION TRUST
Southern Health NHS Foundation Trust,,SOUTHERN HEALTH NHS FOUNDATION TRUST
Surrey and Borders Partnership NHS Foundation Trust,,SURREY AND BORDERS PARTNERSHIP NHS FOUNDATION TRUST
Sussex Partnership NHS Foundation Trust,,SUSSEX PARTNERSHIP NHS FOUNDATION TRUST
Tavistock and Portman NHS Foundation Trust,,TAVISTOCK AND PORTMAN NHS FOUNDATION TRUST
"Tees, Esk and Wear Valleys NHS Trust","Tees, Esk and Wear Valleys NHS Foundation Trust","TEES, ESK AND WEAR VALLEYS NHS FOUNDATION TRUST"
West London NHS Trust,,WEST LONDON NHS TRUST
Worcestershire Health and Care NHS Trust,,WORCESTERSHIRE HEALTH AND CARE NHS TRUST